statename,gender,educ,partyid,firstthought,taxpayer,percenttp,recent,tpfeel,biggest,wagesal,paystub,child,depend,glad,upset,benefit,wastecents,wastethink,eitcself,eitcexp,eitcother,eitcthink,labforce,polideo,polinffreq,regvote,feelfedgov_1,voted,discusspol,poleffic,polvol,polknow1,polknow2,polkno3,marital,ownhome,stateresid,yearbirth,raceeth,hhinc,weightvec
Florida,2,3,7,the government that likes to spend all of our money and take more and more from us and not spend it wisely. Need to get rid of that system ,1,91,in 2013 while my husband was still alive and now I am at poverty level ,like I am being ripped off by the government that feels like they can spend it on stupid things and not be accountable to the people that they take it from,"taxes on the home and clothing,and gas. ",1,"fica, social security,  ",0,0,I am not glad for any thing that my taxes paid for. It is just a rip off by the government ,"that they spend it on all kinds of stupid things like massages for rabbits, and stuff like that",no I have not benefited from the taxes that I paid ,97,"National education association, EPA, Home land sercurity, ",3,,3,,8,7,2,1,1,1,3,1,4,2,1,3,2,1,10,26,1,2,0.343243209
Ohio,1,2,5,"the irs comes to mind, house taxes come to mind,sales tax comes to mind",1,80,at Meijers today while buying household items,I FEEL LIKE EVERYONE ELSE IN THE COUNTRY,Probably the gasoline taxes,1,"state,local,federal",0,0,"schools,schools,schools,schools","jails,jails,jails,jails,jails",not right now I don't,10,nothing,1,it helped out with a little extra money,2,I think it is good for the people who have kids in school,8,4,4,2,40,2,4,3,4,4,4,6,1,3,36,24,1,14,0.631508565
Pennsylvania,1,5,2,Payments to a governmental unit,1,86,Paid electric bill yesterday,"It is OK but sometimes if is a lot of money, it can be taxing my patience.",medical/medicare/,1,local eit / state eit occupational priv / state income  / fed income / medicare / ,0,no,"national park system, cdc, police, fire","politician perks, junkets, graft and so on - they rip off more money in a second than I will earn in a lifetime.",benefited yes but also taken advantage of the structured methodology,60,"armed warware and ""gifts"" to waring nations",3,,3,,6,5,3,1,7,1,3,5,4,2,1,6,1,1,39,15,1,11,0.627845355
Connecticut,2,2,5,Paying outrageous amounts to state and federal government.,1,70,I pay sales taxes daily and property taxes yearly. I'm elderly and do not have to pay either state or federal income taxes.,It would be better to have something to show for the taxes that I pay.,Sales ,1,"FICA, State and Federal Income Tax and Medicare",0,no,Security for the country and the military.,Welfare for people who don't deserve it and women who continue to have babies because welfare will take care of them.,My Social Security tax is being used now to help me survive.,50,Federal officials' wages.,3,,1,I think it is good for people who deserve it. It helps them out.,6,4,2,2,40,2,3,3,4,1,2,6,3,3,7,14,1,7,0.627845355
NA,2,2,1,OH GOSH   I hate taxes there no fun  ,2,14,NEVER  had to pay  taxes in my life,It feels not good even if i had to pay them,house taxes  make up a biggest part of my family,0,,0,no,nothing   they pay for cause i don t have to pay taxes,nothing cause i dont pay taxes,cause im disabilid so i dont pay them,33,everything,3,,3,,5,7,4,2,44,2,4,4,4,3,1,5,5,5,53,46,1,NA,0.973295269
Indiana,2,2,4,How much money is the government going to take from me and my family this year.  Taxes are really high and the middle class people pay the price for it. ,1,70,I pay taxes for almost everything I buy.  Then taxes are taken out of my husbands paycheck every week.  On top of high gas prices we have tax.  Buying at a restaurant we have tax on the food and drink we buy.  So we pay some kind of tax every day.,If the money went for a good cause it would be great.  I think a lot of my tax dollars goes for other countries and not my own.,"Well as explained in the previous question, the sales tax we pay is the biggest part and the tax taken out of money earn every week.",1,"Federal tax, State tax and Local tax. ",0,no,Honestly I don't think there is anything my tax dollars pay for.  Maybe there might be something out there but I don't know what at this time.,"They pay politicians that lost their way of taking care of this country.   My tax dollars goes to foreigners.  They pay outrageous amounts for benefits that the politians will have even after out of office.  The should endure what the US citizens endure.  To me, the violated the constitution by changing it to benefit them.",Absolutely not.  I know there is government help for those in need but to be denied for having 3 dollars too much is unreal.  I don't think my tax dollars benefit me in any way.  It goes to others outside my country.,90,The government having their fingers in all countries and that is where a lot is wasted.  Our government needs to focus on this country.,1,It gave a little bit back to use in the return.  ,1,"Any little bit that gives back to the citizens is good.  I know it does help the poor, but I would like to see it all benefit the middle class. ",8,NA,3,2,9,2,3,2,4,2,4,6,1,1,15,31,1,13,0.631508565
Minnesota,2,5,2,extra money pay to the goverment either federal or state to pay for programs,1,87,This am when purchased gasoline ,"OK, part of life",federal income tax pay,1,"federal and 2 diferent state taxes, social security",0,0,"education, roads, retiremnet","that people don't all pay their fair share, rich find loop holes to get out of paying",roads drive on,44,nothing specific,3,,3,,1,4,3,1,27,1,3,4,4,2,1,3,5,1,24,28,1,14,0.631508565
Kentucky,2,1,1,money I get at the end of the year for working,1,6,going shopping at walmart,I feel proud to pay taxes but also feel robbed of funds,household Items,1,school tax property tax social sercurity tax ,0,0,helping keep the roads paved,the price of food and household Items,no because I'm not old enough to enjoy it,50,trash,3,,1,I think it is good thing because some families just get by,9,2,3,1,42,2,3,3,4,1,4,6,3,3,18,34,1,1,0.343243209
Minnesota,1,3,4,money taken from each check to help support the country and all it has to offer,1,82,"yesterday when i ordered something on amazon, i paid state tax","although it can be a drain on my finances some times, it still feels like a privledge to pay and to have a job so i can",income,1,"fica, state, federal, city",2,2,"roads, schools, support of programs like social programs",to support people who are not legal americans with unemployment and social services,my family has benefited with money for schools and road improvements and a little social services,33,"paying too many people to do pretty much nothing , i know people who have state jobs and they and many people they work with spend a lot of time on personal calls, shopping online and playing games rather than actual work",1,it makes a difference in whether or not we get a refund,1,i think it is a good and fair break for families with children,1,4,2,1,29,1,2,2,4,2,1,6,1,1,24,25,1,13,0.631508565
Florida,2,2,7,goverment taking your money ,1,71,i had to pay sales tax today ,like your being taken adavntage of. you pay taxes out of each pay check plus when you purchase something you have to pay sales tax whioch costs you more so everything you do you have to pay taxes,propety tax,1,goverment social secirity,0,0,nothing they made it impossible for florida to legalize medical pot,everything it should be regulated better / ,nope im not on welfare so i dont get any benifets plus im white ,100,obama,1,i got more back ,2,if you make so much or you get paid to have kids,4,4,2,1,9,1,2,2,4,1,1,6,5,1,10,56,1,10,0.789782315
Texas,1,3,NA,nothing nothing nothing nothing nothing nothing,1,50,november 2014 november november november,not sure what to say about it,not sure what to say not sure what to say,1,not sure what to say but we must pay ceser,0,2,not sure what to say but we must pay ceser,not sure what to say but we must pay ceser,not sure what to say but we must pay ceser,62,not sure what to say but we must pay ceser,1,not sure what to say but we must pay ceser,1,not sure what to say but we must pay ceser,6,4,3,2,48,2,3,3,3,3,3,4,1,1,44,19,1,1,0.343243209
New Jersey,1,6,1,We lose.  The rich get richer!,1,61,Today in my paycheck.  Sales tax in the stores I went to today.  My property tax on 11/1.,I'm ok with it but I feel that the rich & corps are not paying their fair share.,income,1,"fed, state, local, ss, unemployment, disability, medicare",0,spouse,"infrastructure; ss (wish it wasn't DOUBLE TAXED because of other earning), climate control; environment (yeah, right)",Supplement rich & corps & pay politicians who only use us to get richer.,I thank God for LBJ's Great Society.  It got me through school but it is long gone now.,100,"Their salaries; their over budgets on everything; their wasteful spending; their dealings with their ""buddies.""",3,,3,,2,1,1,1,30,1,2,1,3,2,1,3,1,1,31,17,1,NA,0.754888953
Ohio,1,2,2,"Government, politicians, taxpayers",1,60,I paid the local city tax,good and bad,Federal Tax,1,"Federal, State, City, Social Security, Medicare",0,0,Education Transportation Highway,"Not enough money is being spent on Education, transportation and Roads",No not all the time,87,Spending the tax payers money foolishly and things other than what they are needed for,3,,3,,5,4,2,1,20,1,2,5,4,2,1,3,5,1,36,28,1,1,0.427902551
New York,2,2,2,I think they are going to tax my paycheck or any item I might buy more. or tax more on Social Security,1,90,I JUST PAID THE VILLAGE TAX AND NOW I STILL HAVE TO PAY SCHOOL TAX EVEN THOUGH NO CHILDREN IN SCHOOL ANYMORE,To be a taxpayer it feels terrible.  I am going to be 70 years old this month.  Still have to work as I can afford to retire,property tax and taxes that come out of my paycheck,1,"Social Security, Federal Tax, State Tax",0,0,I am glad that if people who need help receive help but their are people who milk the system that is what gets me mad,"I get mad when I hear we are paying for food, and housing for people who crossed the board illegally to get in our country.  They should be turned right now where they came from.  No one asks us if they can use our money ",A little bit as I am getting Social Security but I still have to work. Have been a single Mom raising three children on my own. Never made enough money to live comfortably,100,"giving money to foreign countries, giving money to illegal people. My Mom came here in 1927 from Scotland at the age of 16. The boat ride to New York at that time was $50.  My Mom told me that she had to be spoken for which she was. Her two sisters were here and they had to take care of her. There was no welfare. She could not get a job in the phone company as they told her learn how to speak English. She told them she spoke the King's English. Can you imagine an employer doing that today. No one gave my Mom anything. She came here legally",1,It gave me extra money especially when my ex was not supporting his children,1,I think it is very good for Single parents raising their children on their own,1,4,2,1,2,1,2,1,4,1,1,6,3,1,33,12,1,12,0.627845355
Illinois,2,4,7,Looking forward to the refund,1,75,Taxes are withdrawn from paycheck,ok,not sure,1,"federal, state, ",0,no, not sure - don't really think about it.,don't really think about it.,i guess. It's my responsibility as a U.S. citizen & i feel blessed that i live in this country,50,stupid research projects that won't help anyone.,3,,1,no opinion,9,7,3,1,40,1,4,3,3,4,1,3,1,3,14,26,1,9,0.538743107
Utah,1,2,4,over spending by politicians,1,10,"Federal,State income taxes, Sales Tax",don't like it,property taxes,1,"Federal,State",0,0,"schooling, roads,research","politicians pocket books, wasteful  spending",no,80,everything,3,,3,,1,NA,3,NA,2,2,3,3,4,3,3,6,5,1,45,45,1,6,0.718334602
Ohio,1,3,2,too mnay for poor not enough for rich,1,80,at store buying soda plus paying my bills like cell phone lights gas ,not good,federal taxes,1,sociaol secrutiy,1,no,serevices for elderly people,abortion babies  anytihing else ,yes,71,vacations bussiness trips,1,help ou tlot,1,it good need to raise up hom much more money to get,6,6,2,1,80,1,2,1,1,1,1,1,3,2,36,27,2,10,1.375829411
Texas,1,2,1,Money that you pay at the end of the year.,1,90,None of your business what i pay,Not willing to tell you,None,1,None,0,0,School taxes thatneed to be paid,I am not upset with anything,Yes,100,Not sure,3,,3,,4,1,4,1,100,1,2,1,1,4,4,6,4,1,44,32,1,NA,0.519600055
Montana,1,2,NA,money and rich bitch including the united states of america,3,9,umm when i i got money tooken out of my check working for my cosuin at a sprinkeler job,i dont feel anything really?,working in the forest,1,2,0,no not really,the gas and the parks picking up trash including paying for food of the homeless and etc,cops and the laws thats it pretty much,yes because it was quite a bit of money taken out of my check,40,the president wasting money on stupid shit,4,,1,it's decent at least i mean im still alive in all so pretty well,7,NA,4,2,30,2,2,3,4,4,4,6,5,4,27,64,1,4,3.523345699
Minnesota,2,4,2,govennment taking money from us to pay for other  things,1,70,it was a sales tax of %6.5 on some ink for my copy/photo machine,its okay because I don't see a large some of money going out of my income,sales tax,1,federal taxe state tax,0,none,I can't think of any right now,I don't know I can't think of any thing right now. I may not think that I'm upset about any taxes. Oh maybe tax on a used car.,I can't think of any thing for this question,56,,3,,3,,6,4,2,1,41,1,1,1,4,2,4,6,3,3,24,20,1,3,0.427902551
Texas,2,4,3,"When I hear the word ""taxes,"" I just think of paying taxes.",1,81,The last time I paid any kind of tax at all was income taxes in April 2014.,Neutral,Income tax,1,"FICA and one or two others, but it's been a while, so I don't remember.",0,No,My SS tax for retirement.,"I'm not upset because I don't know exactly what tax dollars are paid for.  I know some goes into SS, but that's mine, and some into Medicare/Medicaid, I think also, and then what the federal government does with the rest, I have no idea.",I don't know.  Social Security is mine for retirement.,60,"I don't know for sure.  I just always hear that a lot of it is wasted, and I'm sure it is.",1,Lowered taxes.,1,I like it because it lowers my taxes.,2,3,3,1,50,1,3,2,4,2,1,6,5,3,44,34,1,7,0.432154266
Virginia,2,2,4,trying to find all paper work,1,44,last week when i got paid,not very good...money could be spent better,alot of it....it sucks,1,state federal social security,1,0,rent bills kids anything we need,nothing maybe they use it the best way they know how,no i do not,68,theyre paid checks and salarys,1,alot gives the extra money we need,1,very good....please keep it,1,5,2,1,46,2,2,3,2,3,3,6,1,3,47,45,1,11,0.789782315
Massachusetts,1,2,5,Wasted money forcibly removed from workers under law.,1,40,I bought beer and paid both a state and federal tax on the purchase.,Like I'm being robbed.,Income tax,1,"F.I.T, MA S.I.T., FICA SS, FICA MED",0,0,Police and Fire departments. Infrastructure maintenance.,"Legislator pensions, over staffed government offices, social handouts.",My neighborhood is safer with the police around.,60,"pet projects, handouts, welfare programs.",3,,3,,1,4,3,1,39,1,3,5,4,1,1,6,1,1,22,18,1,17,1.294973709
Massachusetts,2,3,2,Its near the end of the year so I better start gathering information so I'll be ready to do my taxes before April 15,1,60,"I have paid taxes every year of my life since I was out of high school...over 52 years. Plus I pay sales tax, gas tax. / Last time was today when I bought gas and storage bins.",I think we should all pay our way.,income taxes,1,"Federal tax, State tax, Social Security tax",0,1,"Education, helping to feed the poor, police, fire, and our military",Inflated salaries for too many people / Social Security for people who didn't pay into it. / Abuse in spending by members in power. / Over the top pensions for politicians,No as much as others. I have a city pension so I'm only clearing $12.00 a month from Social Security even though I've worked under Social / Security at least 17 years. Other people who work are allowed to receive pensions from more than one company and their Social Security and / also in many states people can collect both Social Security and their pension. If its a Federal program it should work the same for all. I also wasn't allowed to collect half of my husbands after he died.,40,The salaries and benefits paid to elected officials who haven't been doing anything to help this country. ,3,,2,I think if a person is working and just not making enough to support his or her family deserves some help to make ends meet.,2,3,2,1,42,1,2,3,3,1,1,3,2,3,22,10,1,14,0.73595321
Pennsylvania,2,2,4,excessive spending by the governments taking my earned income,1,34,I pay it every pay check when they take it out,like a never ending viscious cycle,federal taxes,1,"Federal, state,local, uc tax, medicare, social security, union taxes (fair share and I don't belong to the union)",0,0,I cannot think of much as none of it benefits me or the country at large.  They waste more than they know what to do with,"excessive spending on things and programs that are pet projects for congress people, also monies to drug companies, oil companies and others of this kind that profit and say they cannot afford it.  Also bailouts...i say let fail","no, I don't...the roads are poor...nothing much gets done around here for the things that need done in the community or the country at large from what I can see",68,"bailouts to various companies and subsidies to things like oil, etc",3,,4,,1,4,4,2,10,2,3,2,4,4,4,6,5,1,39,42,1,NA,0.943841593
Florida,2,6,4,income--i'm in a state with no income taxes,1,50,I made a purchase in a store a couple of days ago and paid sales tax,responsible,federal income tax,1,"federal income tax, social security taxes, medicare--though I'm not sure you can call that a tax",0,0,"Libraries, roads, schools","Again, not sure I'm educated enough to speak to this, but offhand, I'd say some of the expenses for elected official. SOME!","yes; taxes pay for many thinngs I take advantage of including roads, schools (even though I don't have children), libraries, and no doubt many other social services that I probably don't even realize",2,"I don't think I can speak to this. I'd like to think that there really isn't much government waste, and I think that the definition of what constitutes government waste would differ depending on who you ask.",3,,3,,1,4,3,1,40,2,3,2,4,1,1,3,5,3,10,39,1,12,0.789782315
Louisiana,1,1,4,Money baby commingled to me,1,48,Four years agoi think I did not shur,It the greatest thing ever,medical taxes,0,,0,0,Streets repair child care,politics gay rights false causes,No,36,campaitn,3,,3,,4,7,4,2,40,1,3,1,4,3,4,6,3,3,19,43,2,2,1.601966451
Texas,1,5,1,Government  collecting money,1,39,We all pay some type of tax through shopping,it feels ok,income taxes,1,I don't recall,0,0,roads and services and care for seniors,I am not upset with anything,no,10,nothing,3,,4,,1,4,3,1,26,1,1,3,1,2,1,3,3,3,44,24,2,NA,1.326942338
California,2,4,6,Goverment taking citizen's hard earn money away,1,72,Taxes when I made a purchase in the store,good and bad because I am doing my job as a citizen but I ending up losing some money,property tax,1,"Fed, fica, state",0,1,school education and healthcare,the governament on their personal spending,none,81,executive spending on their traveling and vacation,3,,NA,,1,5,2,1,50,1,2,2,2,2,2,1,1,3,5,37,4,15,1.176626343
Tennessee,1,3,5,Theft by the Government of my money,1,43,When I bought my dinner tonight.,Overburdening,Income,1,FDIC,0,no,nothing that the feds spend it on,"Abortions, Lazy Bums, Polititions",No,98,All programs,3,,1,It is a bad idea,1,7,1,1,1,1,4,1,4,2,1,3,1,1,43,25,1,10,0.432154266
Alabama,1,2,NA,"What came to mind in my book is when you see the word taxes"" I'm sure most people think of paying taxes or even don't wanna hear the word taxes. That's what comes to mind in my head",2,58,Well I do work but other then that I'm paying taxes ,It feels really bad because of what's happening ,depending on what we doing and how we handle it,1,"Everything! Food, health, child support you name they taken it. ",0,no,No I'm not glad at all about the hole thing,No it's just sad the way it all works!!,You know what no I don't ,32,that the government is hiding so deep shit that's what I think. and trying to cover it all up. ,3,,3,,1,NA,1,NA,42,2,1,NA,4,4,4,6,5,4,1,51,5,1,1.601966451
New Jersey,2,6,2,anything you make money on can be taxed,2,70,I had some stocks that I had to pay taxes on ,there's nothing wrong with paying your taxes you have too ,none I'm retired,1,federal taxes and social security,0,0,"medical needs, clothing, and food",bills and plans that do not have anything to do with help the people in America,"yeah, I able to get some of my benefits from working at a young age",72,war,3,,3,,6,4,3,1,60,1,3,3,4,2,2,2,5,3,31,49,2,4,1.592262766
North Carolina,1,4,7,"I naturally think of the democratic party. That is one of the foremost things on their mind. I was born and raised to be a democrat. When I kept seeing what they do, I changed parties while I was still in my 20's. Never have regretted it,",1,60,My last paycheck in June when I retired. Property tax in September. Sales tax almost every day. Gas taxes at least once a week.  ,,Sales tax,1,"Federal,State,Social Security",0,1,The Armed Forces is the best thing.,"Abortion, foreign aid to countries that hate us, public assistance to those who are just too lazy to work.",Only with The Bush Tax Cuts,99,"Buying cell phones for people, Obamacare, foreign aid to countries who hate us, Wine and other alcoholic drinks for The White House, Expensive Dinners at the white house.",3,,1,I think it is fair to the unskilled minimum wage worker but they should be limited to 2 children.,6,7,3,1,80,1,2,1,2,2,1,3,1,1,34,20,1,13,0.506566333
Ohio,2,3,7,money paid to the government,1,50,"yesterday, I went to the store and paid tax on items purchased",a necessary evil,sales tax,1,"federal, state, local, ",0,0,"social security. medicare, military","president, congress, senate","not really, I never took government assistance",81,giving contracts to minorities that overcharge for services,1,"was great at the time, but that was many years ago",1,good thing for young single mothers,6,7,1,1,52,1,2,1,4,2,1,3,1,1,36,22,1,8,0.538743107
Ohio,2,3,4,The government is taking half of my paycheck,1,74,I had to pay taxes on my social security,Something that everyone has to do,30%,1,Federal state system security FICA city,2,0,I can think of absolutely not a thing,I upset that my tax dollars pay for all the people that are not working that are free loading,We have not benefited from our tax dollars ever since we been paying tax,91,government is too large and they don't decide what to do on the money,3,,1,It's good for the people that work and earn the credit not to people that make just a small amount of money,6,5,1,1,3,1,2,2,4,1,1,6,1,1,36,32,1,12,0.538743107
Kentucky,1,2,NA,I really like this survey,1,100,I really like this survey,I really like this survey,I really like this survey,1,I really like this survey,13,I really like this survey,I really like this survey,I really like this survey,I really like this survey,100,I really like this survey,1,I really like this survey,1,I really like this survey,7,1,1,1,20,1,3,2,1,1,2,6,6,1,18,52,2,19,5.000009728
Florida,1,2,7,The Internal Revenue Service,1,30,In 2014 mytax burned was $750.00,I hate it. I am retired and trying to survive as priceskeep going up,Income tax ,1,"withholding, medicare. unemployment socil security",0,no,"The military, social security, medicare",Money wasted byour government,"Yes. Social Security, Meicare",41,Congress waste,3,,3,,6,6,2,1,5,1,3,1,4,2,1,3,2,1,10,1,1,10,0.631671616
California,2,2,4,The first thing that pops in my mind when I hear the word taxes is tax returns.,1,43,Have yet to hold a job for a substantial amount of time to pay them as of yet.  They are taken out of my check from the temp agency I am employed through though. ,It feels somewhat fulfilling being a productive contributor to society. ,I prefer not to answer this question. ,1,I cannot recall at this particular time. ,0,no,I am not entirely too sure. ,To fund warfare. Too many innocent people have died as it is. When is it going to stop because enough is enough. ,No not quite. ,68,"War on black op's that are disinformed to us,  also for monitering of  innocent people. ",4,,3,,2,NA,2,NA,17,2,3,5,4,4,4,6,5,4,5,56,1,NA,0.570545043
Washington,2,4,7,The IRS & headaches it all encompasses.,1,60,The last time I went out for coffee.   The price included the sales tax.,"Troubled, since the taxes that we have to pay these days are far too high because our national government is spending far too much, as is our President.",Don't know for sure.,1,can't rmember - too far back.,0,no,Don't know that I am glad for what my  tax dollars apy for.,"Everything that I read about or hear about our President giving all our money to all of his friends, where ever they may be.",Have no idea.,79,The Presdient sending monry to everyone he can think of!,3,,3,,6,6,3,1,29,1,2,3,3,4,4,6,1,1,48,7,1,10,0.574527399
