statename,gender,educ,partyid,firstthought,taxpayer,percenttp,recent,tpfeel,biggest,wagesal,paystub,child,depend,glad,upset,benefit,wastecents,wastethink,eitcself,eitcexp,eitcother,eitcthink,labforce,polideo,polinffreq,regvote,feelfedgov_1,voted,discusspol,poleffic,polvol,polknow1,polknow2,polkno3,marital,ownhome,stateresid,yearbirth,raceeth,hhinc,weightvec
Indiana,2,3,6,Our out-of-control government spending and debt is at a crisis stage yet Congress continues to spend money like tomorrow will never come.  It is high time that our federal government begin to significantly CUT spending and begin to pay down our debt.,3,70,I pay a 7% sales tax each and every time I purchase goods or services in the state of Indiana.,Overwhelming,Sales taxes,1,Social Security tax / Federal income tax / State income tax / County income tax,0,0,Police departments / Fire departments / Roads & highways / Military / ,Government excess / Elaborate vacations for the President and his family / Elaborate travel for members of Congress / Over-sized and/or under-performing governmental departments / Over-lapping governmental departments / Need I go on ........ / ,Police and fire departments keep me safe - though thankfully - I have never personally had to use either. /  / I travel on roads and highways.,60,Over-sized governmental agencies - many of whom overlap and/or have no clear purpose or service to the American tax payer.,2,I got more back in the way of a federal income tax refund,4,,4,4,3,1,20,1,2,1,3,2,1,3,3,3,15,22,1,1,0.427902551
Illinois,2,5,3,that they are too high and seem to be getting higher. Every tiome I turn around there is either a new one or an increase in an existing one,1,76,yesterday when sales tax was tacked on to my bill at a store while shopping,somrwhat powerless,income taxes,1,"federal income tax, state income tax, FICA, Medicare tax",0,no,"roads, police, fire, defense, air traffic controllers, environmental protection, the weather service, public libraries, schools, caring for people unable to care for themselves","legislative pension payments - being a legislator should not be a career that generates retirement benefits, aprticularly when the retirement was being ""fired"" by the voters","of course - roads, police and fire protection, government funded health research, and more",8,"overloaded bureaucracies, paperwork for the sense of paperwork, legislative pensions",3,,2,"Their purpose (to help families) is good, although I think the tax code makes it a little more difficult than necessary",6,4,2,1,60,1,2,4,4,2,1,3,1,1,14,20,1,19,1.624211387
Arizona,1,2,4,Nothing Idk I never paid taxes before,2,47,In prison in 2009-2011working in prison for 2.5years,Idk,idk,0,,0,0,Medical for unfortunate people,On building more jails an prison,Better job research,27,need more rehabaltion homes,3,,3,,7,NA,4,2,97,2,4,NA,4,4,4,6,6,4,3,47,5,1,1.457044443
New Jersey,1,2,4,Democrats-Liberals-Socialist-Obama,1,50,"Sales tax etc, Gasoline Federal Tax, State income tax, and of course Federal income tax","It sucks knowing I help to pay for all the underachievers, non taxpaying Gov.leaches!",Federal income tax,1,"Federal income tax, State income tax, Social Security tax, Unemployment tax ",0,1,Are you kidding me I am not glad about paying taxes until the 50% of this country that does not pay taxes --PAYS,"All the ridicules nonsense Liberal Government programs,IE Obama phones etc.",No,80,Wellfare to people who don't deserve it,3,,3,,6,7,1,1,20,1,1,1,2,2,1,3,1,1,31,16,1,15,0.73595321
Texas,1,2,4,money you pay each year if you work,2,75,when I eat or buy something,something you get use to,food items,1,income tax,0,"no,  do not pay income tax","roads, schools, making life better","big government, paying contractors and nothing and done ",not sure,19,big government,3,,3,,6,6,4,1,2,1,3,2,4,2,1,3,2,3,44,13,1,4,0.501712027
North Carolina,1,4,7, The federal government at it's best,1,40,On the money I make and on everything I buy,It feels that I am being taken advantage of ,Taxes that i pay on everything i buy,1,"Federal, State, Social Security",0,0,The people that help protect my country,All the illegal immigrants coming to this country,Yes. I live in a safer country,40,All the pork that senetors and congress vote on ,1,It gave us more money to spend on things that we needed,1,It is a good thing for families that have a low income,1,5,4,1,30,1,3,1,4,2,1,6,3,1,34,14,1,11,0.631671616
Florida,1,5,1,money for all the middle class people,1,80,yesterday buying groceries,normal,federal income taxes,1,federal and state,0,no,"elderly, homeless, unemployed",rich people who find loopholes,no,29,house of representatives,4,,4,,6,1,1,1,98,1,1,2,2,2,1,6,3,1,10,10,2,13,1.890913852
Texas,1,4,7,"unfair, too high, too many",1,39,gas tax when I got gas earlier this week,burdened,federal income tax,1,"federal income tax, state income tax, fica, medicare",0,spouse,"military, border patrol, Coast Guard","Dept. of Health & Human Services, Department of Education, Department of Energy, Department of Labor, Department of Housing & Urban Development, Department of Agriculture, Ddepartment of Veteran's Affairs, Department of Homeland Security, EPA, Bureau of Land Management , Department of the Interior, CDC, NIH - and that's just warming up!","I.m retired military, so I paid my own salary.",90,Everything the government does outside of the 18 enumerated responsibilities in Article 1 Section 8 of the Constitution,3,,1,It should be eliminated.,6,7,1,1,9,1,1,5,3,2,1,3,1,3,44,14,1,11,0.631671616
Tennessee,1,2,4,"alot of money and hoefully its going for good things we need not stupid things,and they need to kepp taxes low on low income ppl they can;t afford too much they struggleing as it is ",1,91,sales  taxes at the store and i wroked for a few months took taxes out on me o nthat too,its ok as long as the money is gonig to help things we need not silyl things we don;t,work taxes??,0,,0,0,"schools,,things to help ppl get healthcare or meds that need it and to help with whatever we need too not silly things",silly things like things that policans want liek rasies etc they don;t need that al lthat,well helps kids in shcool etc i am all for it but liek isaid some things r eh they do lol,60,"raises,silly programs that don;t help ppl or helpsonly a few ,,do something thathelpsmils not jsut hndreds",2,not much,3,,7,4,4,1,59,1,3,3,3,1,2,6,5,2,43,57,1,10,0.789782315
Illinois,2,2,4,hope i have the money for them,1,71,i paid my income taxes last year,it sucks,if we get money back at the end of the year,0,,0,husband,"my pet food ,our food,money for gas in our cars","schools,the president,constrction",no,100,they take tomuch taxes out of my check,3,,3,,1,5,4,1,50,1,4,3,4,4,4,6,1,1,14,25,1,1,0.427902551
South Carolina,1,6,5,Obama wants to rise all the wealthy taxes,1,40,At the gas station yesterday,OK except some do not pay their share,Fed income tax,1,"Social security, medicare, federal tax and state tax",0,spouse,"highways, medicare, federal agents",congress and the president,just for medicare,39,some of these crazy studies that waste money,3,,1,I do not believe in it,6,6,2,1,40,1,2,2,4,2,1,3,1,1,41,9,1,18,1.904373751
New Jersey,1,2,7,too many; mostly increased by democrats,1,40,pay sales taxes daily plus deductions from my income,i paid them long enough. now it's a sin to be entitled?,i do not budget. my income is sufficient.,1,"fica, sui, medicare",0,0,future ss and medicare benefits.,freebies to illegal immigrants and elderly people who imigrate and are immediately put on ss and other benefits after not contributing a dime!!,after working all my life what do you think?,86,"obamacare, bailouts, legislatures who no longer listen to the people.",1,not any longer,2,it was good when i qualified; should only apply to wage earners. everything else is just another giveaway for people like me.,6,4,1,1,3,1,3,1,4,1,2,6,1,1,31,15,1,18,1.892838277
Indiana,2,6,7,paying out money that is owed,1,69,paid tax on what I bought at the store this week.,If feels like I am a productive part of society,income taxes,1,don't know been too long ago,0,no,don't know since I don't know that much about taxes,don't know since I don't know that much about taxes,do'nt know,37,don't konw,4,,2,don't know,9,7,4,1,44,2,3,5,4,2,2,3,1,1,15,18,1,11,0.538743107
Maryland,1,3,2,"o malley the soon to be former govener of Maryland and his little helper,lt. govener oh I forgot his name alreadyo my o my.",1,51,today when I put gas in my car,"over worked, over taxed",federal income,1,fed state medicare soc security local,0,0,to take care of the poor illeagles in this land.,welfare hand outs to generation after generation of lazy people,no,40,wellfare,1,helped a little,4,,1,6,1,1,10,1,3,1,4,2,1,3,3,1,21,18,1,12,0.432154266
California,2,3,4,"WHEN I HEARD THIS WORD""TAXES"" I FELT IT'S A RULE ON THE USA LAW",1,83,IT LOOKED LIKE MUCH MORE PLACE NEED TO PAY THE TAX AS THE MONTHLY INCOME,NOTHING FELT,,1,,NA,,,,,50,,NA,,3,,1,4,3,2,39,2,4,3,NA,3,3,6,1,1,5,47,3,16,2.15034017
Florida,2,2,2,Our taxes are being wasted by an incompetent Republican congress that refuses to compromise,1,60,I paid tax on my house through a cheque today,glad I have an income so better than not having to pay any house taxes because I own a home,income taxes,1,"health insurance, unemployment insurance, ",0,0,"roads maintained and bridges, ",salaries for congressmen that do little work and then retire with huge pensions,no,40,"money spent on other countries and wars that were based on lies, overpriced equipment that is now obsolete",3,,3,,6,2,1,1,80,1,3,4,3,2,1,3,1,1,10,6,1,17,1.904373751
North Carolina,2,3,4,The first thing that comes to mind for me is having to pay lots of money to uncle Sam or the government.,2,71,I have not paid any taxes yet because I done have a job.,I am not a taxpayer right now.,I am not sure what taxes make up the biggest part of my family's budget. ,0,,0,no,I am glad it helps people that cant afford things for themselves.,I am upset it helps drug addicts and criminals.,I haven't paid any taxes so anything will benefit me.,82,entertainment,3,,3,,7,4,4,2,2,2,4,2,4,4,4,6,5,4,34,64,1,11,4.87722426
New York,2,2,4,money that i own to the school or the state ,1,75,at the store when I bought socks,that everyone wants my money and there is never enough,school taxes,1,state and federal taxes,1,0,school taxes because it helps with the education of my child,Medicaid taxi rides to appointments,no,50,paying out for insurance based rides,1,i got more money back in tax return,1,that it is something to help with the support of your child,1,4,4,2,12,2,3,5,4,3,4,6,5,1,33,44,1,8,0.784998321
New York,1,NA,NA,goodgoodgoodfoodgoodgoodgoodgoodgoodgood,1,46,goodgoodgoodgoodgoodgoodgoodgoodgoodgoodgood,good for i you ok,10000,0,,0,1000,paypalpppppppppppppppppllllkhgdsyikgfdkl,cdshkjcdihgffghhggfgggggcdstjjvdsdgh,fdsrijbdsgjhxsfkhfgjfeykferiih,NA,ggsdjjcsfjnb,3,,3,,1,2,2,2,22,2,2,3,4,2,3,2,5,3,33,57,1,5,0.623493423
South Carolina,1,5,4,Stupid people who don't pay any who complain about paying too much.,2,35,"Sales tax earlier today...as you didn't specify, my assumption was this was about income tax.",Doesn't feel like anything at all.,Sales tax.,1,"FICA, Medicare, State, Local, Federal, Disability",0,1,The pathetic amount of healthcare coverage that I get.,Senseless wars overseas and Congress.,"Sure, but not in a way that I'd like. Roads that shouldn't have been built make it easy to drive cars that shouldn't burn gas that is subsidized by tax dollars.",81,Congress,1,Sometimes it meant being able to catch up on debt.,3,,9,1,2,1,2,2,2,5,3,3,1,3,1,3,41,28,5,10,1.103625348
Oregon,1,2,4,"IRS, county real estate tax, sales tax",1,60,"real estate tax, for our home",it comes with being in a lower income bracket,real estate tax,1,"income tax, social security tax",0,wife,"police, fire department, water & sewer departments",things that we don't know about,not really sure,80,services to non American imigrants,1,it helped lower our taxes,2,it can help if you qualify,6,4,3,1,31,1,4,3,4,4,4,6,1,2,38,10,1,14,0.673454506
Florida,2,3,1,necessary to run government,1,100,paid sales tax on purchases made today,"it feels normal, government needs taxes to run",probably income tax,1,"income tax, fifa, medicare",0,no,"clean water and air because of regulations, roads, fema, education, help for the disadvantaged ","congress' paycheck, the military industrial complex, outsourcing, corporate welfare","I go to the public library, I was educated in public schools. I drive on streets built with tax dollars.",10,the defense dept building equipment that they don't need and immediately mothball,3,,3,,8,2,1,1,45,1,2,3,3,2,1,3,1,1,10,26,1,11,0.432154266
Connecticut,2,3,4,we pay too much in taxes on products we purchase and property we own,1,70,I paid property tax on the house I own to the town I live in.,I like contributing to my town and state to provide for services but I think we are overtaxed.,Property taxes make up the biggest part of my family's budget.,1,"State income tax, social security tax, FICA ",0,no,Services in my town such as police and fire. Schools to educate are young.,Goverment that pays itself too much and wastes our money on foolish things,"I know the fire department, police department and ambulances are there if I need them.",80,money that is hidden,4,,3,,8,4,3,1,8,1,3,4,4,1,2,6,1,1,7,28,1,14,0.503497879
California,1,2,4,what we owe to help out financially,1,84,money taken out of my paycheck,it feels good,I'm not sure,1,"Social security, medical",0,no,"Going to the Library, going to the park, public water fountains",Sometime I think that lazy people abuse welfare and stuff like that,"Tax dollars are a huge part of the world's financial system. We reap many benefits and rewards that we're not aware of. Sadly, a lot of benefits are taken for granted. Living In America, which I have served my country, is a huge blessing.",18,"food, clothing",1,It helped out tremendously. A bonus.,1,It's a major blessing. Something that doesn't have to be given to us.,4,NA,3,2,60,2,2,4,4,4,4,6,3,3,5,37,2,1,0.797267752
Illinois,1,2,6,the politions  in washington always wanting more,1,49,sales tax at a store when made a purchase,it is a part of the american way ,income taxes,1,state / federal / social security,0,0,help the people who are in need,studies for something that  has little to no benefit for americans,"from goods and or services government provides, / roads, sidewalks ",35,fraud by paying to much for most if not everthing government involved,3,,3,,2,6,4,1,10,1,3,4,4,2,1,3,1,1,14,24,1,12,0.538743107
Virginia,2,5,7,too high for the middle class and lower class and too low for the richer people,1,70,I had to pay in 2012 for state taxes,I didn't like it too much considering how much taxes are taken out of my paycheck,federal income taxes,1,"FICA, federal, state",1,no,my son's public education - I know that more should go to education but glad he is in the school he is in,the welfare system and those that abuse it,"in some ways as far as education, the roads ",80,the silly spending of trips that are not necesary and their raises,1,it increased my refund when i could get the child tax credit,1,it is a good thing to help out those that have children,1,7,4,1,11,1,2,2,4,1,4,2,3,1,47,37,1,12,0.432154266
Florida,2,2,1,its tough taxes are what we people don't like the taxes then again at the end of the day you still have to pay taxes I think taxes are supposed to be here because back in jesus they had taxes if I am correct I think jesus sat down to the table with some tax people,1,100,if I got it right I paid taxes at the Walmart I don't know maybe you are talking about a different kind of tax,not to good,food,1,I don't know its been a while maybe state taxes I just don't no,1,0,food clothes things you been wanting and could not afford like cars doctor bills get your car fixed ,nothing its been a long while I cannot remember,yes it has when I working I would buy my children clothes shoes everything they been wanting or may I say everything they needed,39,economy,3,,1,its a good thing,6,1,4,1,56,1,3,3,4,4,4,6,1,3,10,25,2,NA,1.326942338
Connecticut,2,2,4,budget deficit and the government overspending,1,96,yesterday at the grocery store for nonfood items and at the gas pump,happy to do my part but not happy with the amount I have to contribute,"local,state and federal and gas",1,"ferderal,state and social security",0,none,roads  and transportation and police,overspending at the state and federal level,feeling safe for the police and medical people,40,pay checks for all those who work in government and do nothing to earn it,3,,4,,8,NA,3,1,0,1,4,3,4,1,1,3,1,1,7,21,1,14,0.503497879
Ohio,1,2,4,MONEY government holding people back that are working hard and giving irresponsible people who hardly work a chance to waste money and not usually on their kids,1,70,i pay taxes every week out of my paycheck and every time i go shopping,it feels fine the money has to come from sumwhere to run the country just wish that it didnt all get spent on the military,none,1,local state and federal,NA,0,not sure i guess schools and healthcare for people in need ss for the elderly and disabled,i already addressed that not sure what else to say,not sure,61,fighting wars thast are not ours and the military,4,,4,,1,NA,NA,NA,24,2,4,3,NA,3,4,6,1,1,36,51,1,13,1.154111704
Pennsylvania,1,3,1,MORE SPENDING AND WASTED REVENUE!,1,50,"WHEN I GO TO THE GROCERY STORE, DRUGSTORE, GAS STATION, OR ANY OTHER STORE.",I FEEL LIKE I AM BEING ILL-SERVED.,GASOLINE.,1,"FICA, STATE TAX, FEDERAL TAX, ETC., ETC., ETC,..",0,NO.,"ROADS, WELFARE, AND SOCIAL SECURITY.","GOVERNMENT OFFICIALS, AND LARGE, ALREADY WEALTHY CORPORATIONS.","YES, I AM ON SSD AT THE AGE OF 65.",70,BIG CONTRACTS. OVERPAID OFFICIALS.,1,HELPS EVER SO SLIGHTLY.,4,,6,4,1,1,20,1,2,1,4,2,1,6,5,3,39,17,1,3,0.498672977
Colorado,1,2,4,money the government takes from us,1,90,When I bought non food at the grocery,Sucks,sales tax,1,federal and state,0,no,improvement to my country,aid to foreign countries instead of domestic,yes/better roads,80,foreign aid,3,,1,helps,1,6,4,1,40,2,4,2,4,3,4,6,3,1,6,49,1,12,0.718334602
Florida,2,2,4,Money being spent. Earning money back BC we always pay more into taxes.,1,60,Every year. Every paycheck we pay into taxes.,Don't feel good or bad. Its what has to be done. Not really a choice,property,1,"Medicare, and I remember seeing others but can't remember off the top of my head now.",1,no,Helping or building public schools for kids. Play areas for kids.,Vacations for mayors or governors. Road work signs talking about road work,Not so much. ,87,signs. ,4,,4,,1,NA,4,2,20,2,3,3,NA,1,1,6,1,1,10,50,1,15,0.92577388
California,1,6,4,IRS (the Internal Revenue Service since you require 25 characters),1,99,"today (this very day, since you require 25 characters)",OK,Federal Income Taxes ,1,Federal Witholding / State Witholding / Social Security Tax / Medicare,0,0,"Armed services and the general protection of the country (Federal level).  Schools, roads, water, etc,, police and fire at the local level.  Highways and many services at the State level.   ","The Federal bureaucracy has balooned beyond our needs. ""upset"" would apply to Department of Education, EPA, and much more","Yes I have benefited from several of the services provided by Federal, State and local governments",25,paying more than necessary for services and goods.  paying for goods and services that are not necessary.  Graft and corruption,3,,4,,2,6,1,1,20,1,2,2,4,2,1,3,1,1,5,9,1,16,0.673454506
Pennsylvania,1,5,2,less disposable income money for social and federal programs,1,75,at the grocery store food tax,good and bad,income,1,fica  state and federal social security,1,no,roada and bridges social security,welfare for people that could work,better roads and bridges,19,fraud,3,,1,good for people with less income,1,2,2,1,40,1,2,2,4,2,1,3,1,1,39,30,1,13,0.503497879
Indiana,2,2,4,Something you are required to pay,1,30,I paid property tax in April 2014 also filed Federal & state,I feel that I should it's what keep our country going,Property tax,1,"Federal,State",0,no,"Help create jobs Road Repair,Defense","Big salaries to Congressman & Senators,Welfare to people that could work & won't",not sure how,60,a lot of programs that are of no benefit to anyone,3,,4,,6,7,2,1,33,1,3,2,4,4,4,6,2,1,15,1,1,9,0.787470485
Tennessee,2,2,7,I think of having to have more money to pay them & they only get higher & higher.,1,90,"When I shopped at the store yesterday for groceries, I paid taxes.","I guess it feels good, at least I'm doing my part.",the FICA taxes that are taken out of my pay check.,1,"FICA, Fed, Medicare",0,no,To help those who really need public assistance.  Medicare & social sercurity.,People who are too lazy to get out & get a job.,"Yes, I believe I will benefit when I'm older & retire from my job. I will have money to live & support my family.",60,When the government gives money to people who honestly doesn't need it. They are perfectly capable of working & providing for their family.,1,It always helped my family out  quite a bit.,1,I think it works very good for the people who have several children & I think it is a good thing.,6,7,3,1,7,1,2,2,4,2,1,3,3,1,43,32,1,3,0.343243209
New Jersey,1,2,4,money that gets deducted out of our pockets,1,81,"all the time, when going to grocery store or pay check",i don't have a stong of enough opinon,lots of taxes,1,local and fed taxes tooken out,0,0,"schools,roads and government spending",where the spending is going,not sure,39,over spending,2,not a whole lot,2,no opinion really,2,4,3,1,72,1,3,2,2,3,2,1,5,3,31,55,1,5,0.623493423
Virginia,2,2,2,the world tax is a way of taking money from people by justifying taking money from people,1,70,last time i paid in september,i can save some money ,if i paid alot taxes ,0,,4,none,not sure cant think any thing,not sure cant think any  thing,no,20,nothing,1,will save some money because of my family members number,3,,8,2,2,1,80,NA,2,3,2,1,1,5,1,3,47,45,1,14,0.92577388
Louisiana,1,3,7,way to much paid for the services rendered,1,50,When I bought my breakfast today.,"I don't mind paying my share, but when half the country doesn't pay taxes, you can only get so much out of the well.",Income tax,1,"Federal taxes, State taxes, Medicare taxes",0,No,Police and fire protection and our armed forces,"Welfare fraud, illegal aliens who receive government money","The services provided by the local, state and federal goverments",30,"The money they use for crazy projects, money given to people who don't deserve it, illegal aliens and an assorted other ways.",3,,4,,1,7,2,1,30,1,2,2,4,2,2,4,1,1,19,23,1,16,0.506566333
Alabama,1,2,4,i was verry dizziness dizzy,1,30,last mount of january with,sometimes heppy and sometimes dant,sometimes happy and sometimes,1,sometimes happy and sometimes,2,yes,yes sometimeshappy and sometimeas,yessometimes happy and sometimes,yes,20,yes,2,yes,2,yes,1,2,2,1,2,1,4,2,2,2,2,3,3,1,1,2,2,12,1.613148041
Alaska,2,4,7,Extra fees that we have to pay for whatever it is we are purchasing.,1,85,I paid tax when I purchased my pizza.,,I don't really know.,1,Income,0,0,I am not really sure what exactly they pay for.  So I don't really know.,I'm not really sure what they pay for.  So I don't rally know.,I don't know.,5,I don't know.,3,,3,,8,6,4,1,50,1,4,NA,4,4,4,6,1,3,2,45,1,11,0.718334602
California,1,5,1,"Income tax. Also, property tax and sales tax.",1,99,I just paid my property tax. Over $2000.   ,"It can be  a lot at times. I don't think about at the grocery store (7.75%). But taxes can be painful, so I budget for them as best I can.","Property tax, over $4000 a year",1,"Mostly withholding for Federal income tax. Also, State tax, and SSI.",0,no,"Medicare, when I get it. Also, FDA and other social services.",High salaries at DOD contractors.,I am sure I have (especially when my kids were at school). But I don't think about it often.,6,Medicare fraud.,2,very slightly,4,,2,2,3,1,62,1,2,2,4,2,1,3,3,1,5,19,1,11,0.3930594
Nebraska,2,5,1,required by a bunch of crooks that only the wealthy get breaks,1,50,I pay into it every month from my dang paycheck,it sucks,45 ercent,1,"fica, federal, insurance ",0,0,I struggle to pay my bills each month - so nothing makes me happy about paying taxes,I have no comment on the subject,hell no,NA,wealthy republicians screwing the middle class,3,,3,,1,6,1,1,40,1,1,1,3,1,1,6,3,1,28,29,1,17,1.624211387
