statename,gender,educ,partyid,firstthought,taxpayer,percenttp,recent,tpfeel,biggest,wagesal,paystub,child,depend,glad,upset,benefit,wastecents,wastethink,eitcself,eitcexp,eitcother,eitcthink,labforce,polideo,polinffreq,regvote,feelfedgov_1,voted,discusspol,poleffic,polvol,polknow1,polknow2,polkno3,marital,ownhome,stateresid,yearbirth,raceeth,hhinc,weightvec
Wisconsin,2,2,4,Paying money to to the goverment,1,50,Two days ago when purchasing items from a store. ,It's part of life so I don't have a problem with it. ,I would have to say monthly purchases of none food related items are biggest.,1,state and federal taxes,4,no,Fixing roads that need to be repaired and health services,"People that abuse the system and take advantage of everyone that pays taxes. For example someone gets food stamps and instead of providing food for their home, they're buying food for other people or buying junk food instead. Or people who get benefits like caretakers and they have Iphones and cable yet their kids don't have clothes or food.If tax money is going to these programs then the people using them should  be have to follow certain guidelines. If you have a child on SSI you have show receipts showing purchases of what you bought them. Why not for caretakers especially for people that are showing abuse behaviors. ",I would have to say yes and no. The yes end would be at that school level tax dollars have been used to give schools free snack programs. A few of the schools have free lunch for all student regardless of income. ,60, Only one I'd say W2,1,I usually get a bigger tax refund.,1,I think it is a good thing to have.I think mothers whom haven't worked but file homestead should still be able to claim child tax credit if they are still providing for their child whether it with child support or government assistance. ,7,4,4,1,67,2,2,3,4,4,4,3,5,3,50,46,1,9,0.984578453
Kansas,2,5,4,fees that you pay to government for their use as they see fit.,1,71,gas tax when I filled up my car yesterday,"it feels okay for the most part, although I do feel taken for granted at times. ",personal property taxes on vehicles,1,"state, federal, medicare, social security",3,no,"roads, police, firefighters",I don't think my legislators should be voting for a pay raise. I think that should be left up to the people who voted them into office. ,We have great roads in our state. The school my children attend use a lot of the federal programs. The taxes pay for the police and firefighters who keep our community safe. ,25,studies on why mice go bald ,3,,1,they are credits meant to help families-they are good credit if they are used properly,1,4,2,1,10,1,2,3,1,2,1,3,1,1,17,44,1,14,1.154111704
Ohio,2,2,2,An expense people in the U.S. are forced to pay.,1,100,Yesterday when making a purchase at a store.,Does anyone feel great about being a taxpayer?  It is just something that is forced upon a person because of government rules.,"Estimated state and federal taxes, paid quarterly each year.",0,,0,"No, its just myself and my spouse.","As I said earlier, keeping the streets plowed in my city for transportation purposes.",Just about everything which is taxed except for food and I believe that will occur sometime down the road.,"Getting the snow plowed off the streets each winter due to tax dollars, otherwise, it would be vertually impossible to travel by car or walking.",60,Constantly sending money out of the country to help whenever a crisis occurs.,3,,4,,8,5,4,1,39,1,4,4,4,2,2,6,1,1,36,21,1,17,1.624211387
Texas,1,5,5,Internal revenue services in receiving my in Federal come tax.,1,39,It was 8 years ago that I last pay income tax..,It is a lonely feeling that I have to pay taxes.,It seem that I pay over 20% on income taxes.,0,,0,No other dependents.,That I am receiving disability right now.,"Right now, nothing right now",yes,40,over paying fo tool and guns used in thew army,4,,3,,6,5,3,1,80,1,3,2,3,4,4,3,3,1,44,19,2,2,0.876566393
New York,2,2,NA,money that comes out of your income to cover certain expenses of the state or federal government,1,60,sales tax when purchasing clothing,necessary expense,"sales, utilitiy",1,"fica, social security",0,0,"fire, education, police, highways","why be upset, doesn't change anything",dont know,19,didn't think of anything,4,,2,"what is there to think, suppose to be for those low income",NA,NA,4,1,50,1,NA,3,4,3,3,1,2,3,33,15,NA,NA,1.927817562
California,1,6,7,Government corruption and excessive spending,1,44,"Payroll withholding, sales tax, property tax.",Ripped off,iincome tax,1,"Federal Income Tax, FICA, CA disability, CA income tax",0,no,nothing taxes need to ge cut 50% across the board and programs cut,"All social programs, taxes should only go for defense and infrastructure",no,84,Social programs pork spending foreign aid,3,,3,,1,7,1,1,1,1,2,1,4,2,1,3,1,1,5,15,1,19,1.732094445
North Carolina,2,2,1,"i think taxes are way too high on everything, from property taxes, car taxes, etc...",1,91,i had to the property taxes on my house and also the yearly taxes on my car,it sucks,hoise taxes,1,"social security, federal & state ficc",0,0,"supporting government funded programs, paying for road maintenance","i think taxes are way too high i get upset when i know & see people getting  / free help"" from government agency, food stamps, medicaid, electric bills paid for, free cell phones and they get this all FOR FREE while I work I have to pay for everything myself, thank god i work so I can pay for their laziness",no because what i have i paid for myself while the lazy non=working people get all the freebies from the government,97,"welfare, food stamps, heap programs and especially medicaid",3,,3,,6,4,2,1,82,1,2,1,4,1,4,6,3,1,34,28,1,10,0.432154266
Massachusetts,2,4,5,money out of my pocket and nothing to show for it,1,81,Just paid my state tax on my home,used,sales tax,1,"state income, federal tax, Social Security ",0,1,"roadrepair, unemployed, people on gove give aways",most things given to people for free and they didnot work for it,road repair  about 50 %,70,support of other countries....still paying Japan for droping the bomb in WWII ... Supporting all the forign countries WORLD WELLFARE,2,not sure,4,,1,6,2,1,51,1,2,2,2,1,1,6,1,1,22,15,1,13,0.73595321
New York,1,3,4,that I will be paying more in the future,1,30,last month when I pd my school tax as a home owner,I do not enjoy it,property tax,1,"fica, social sercurity, federal and state",0,o,the roads and bridges I drive on,my city property tax because they are to high,not really when I have called the police they never have any available,19,foreign aid,3,,3,,6,6,4,1,19,1,3,3,4,3,1,3,3,1,33,20,1,4,0.341164062
Texas,2,2,7,Paying out of pocket extra money for things I buy / ,1,81,Federal tax to the IRS every year,Everybody has to do it,federal income tax,1,social security  medicare,1,0,better schools  better education,welfare for people who don't want to work,not sure what you  mean,82,big fancy dinners for politicians,4,,4,,1,6,3,2,81,2,2,3,2,2,1,3,1,1,44,32,1,18,1.302865633
Texas,2,2,4,money the government takes from our paychecks that we work so hard for to put it in their pockets. ,2,80,three years ago before I lost my job but I still pay takes every time I go anywhere and buy anything.,It sucks cause it takes money out of my pocket that I could have used to feed my kids ,none at this time cause me nore my spouce have jobs,1,S.S. tax ,0,0,I have not seen my tax dollars pay for anything except stupid highways or as the government  calls them toll roads or another way of taking more of our hard earn money to put in their pockets and I bet they never have to do without a thing thanks to all of us working so hard while they sit back and think of other ways to take our money.,Everything that they say their going to do with our tax dollars but they never do.,Hell no I have not benefitted from my tax dollars at all and I can't even get the lazy people to fix my road like my tax dollars are suppose to do ,90,They give it to all these forgin countrys and we have no say so they bail out the rich and let the poor people die ,2,Gives us a little extra money to actually by a few extra things we have needed for a while,4,,4,1,4,1,1,2,4,1,4,4,4,6,1,4,44,42,1,1,0.627293163
Wisconsin,1,3,4,corrupt politicians stealing from the poor to enrich themselves,1,92,yesterday (11/05/2014) at around 6:00 p.m.,"frustrated, abused, angry, and disgusted",sales taxes,1,"state, federal, and fica(social security)",0,none,"protective services (police, fire, emts), roads, parks","extravagant perks for elected officials, political waste and graft, unnecessary interest paid because of the inability of our government officials to balance a budget (all levels-local, state, federal), overpaid government employees, ","yes, from protective services, education, transportation, recreation facilities, and social services",98,"$299 hammers that sell for $2.99 at the hardware store, employing five or more people to do the job of one",3,,3,,6,NA,3,1,10,1,2,5,4,1,1,6,5,3,50,19,1,3,0.427902551
Pennsylvania,2,2,1,More money coming from my pockets.,1,80,I paid taxes on nonfood merchandise.,ok-I know some of the money goes to good causes. / ,income tax,1,"social security, medicare, federal, state, local",0,no,seniors benefits and educational funds,foreign aid and entertainment for the lawmakers,no,19,taxes used for entertainment,1,It made the family less liable for taxes paid over the year.,1,It helps out hard working poor and middle classed parents who has children and are struggling to survive in this economy.,6,4,3,1,92,1,3,3,4,2,1,6,2,1,39,19,2,12,1.096940294
Missouri,2,3,4,money coming out of pocket--like a bill,1,81,Last year I had to pay taxes ,"Well, ok as long as the money goes to take care of America and is taken care of responsibly",food taxes,1,Social security,1,0,Food stamps-TANF--Medicaid--Road upkeep,coins that are being made that no one will ever use,A little with the way the roads are taking care of and through food stamps,7,Paying for coins to be made that will never be used,1,It helps us to catch up on bills and buy any big appliances that we may be needing,1,I like it and it is much needed,7,5,3,1,65,2,2,2,4,4,2,6,3,1,26,36,1,3,0.427902551
New Mexico,1,6,7,It is Legalized Extortion and should be greatly reduced,1,38,I choose to no longer pay state or federal tax,Like I have been used and abused,Sales tax,1,Federal state FICA ,0,No,Military and defense of the country,Social programs for non citizens,No I do not,59,How legal citizens get the shaft while illegals get all the benefits it's sickening,3,,3,,4,7,1,1,3,1,1,5,3,2,2,6,3,4,32,25,1,9,0.3930594
Georgia,2,5,2,an expense that has become expensive,1,81,"at the grocery store, at a restaurant and at the gas station",I feel like I shouldn't have to pay such a high tax rate,"payroll, grocery, gas taxes",1,"state taxes, federal taxes",1,no,Im glad my tax dollars help to pay for roads and schools.,I'm upset my tax dollars pay for jails and politians,I benefit from the tax dollars that are paid for road and schools,50,I think the government waste tax dollars to pay for corrupt politians,1,gives a better refund,1,I think it helps taxpayers get a larger refund,1,4,3,1,49,1,3,3,4,1,1,3,3,1,11,31,2,12,1.103625348
Minnesota,1,5,1,"Fighting, bunch of idiots who think they're 100% bad",2,63,"2005, why do I need to describe the time I paid taxes?",It's ok I guess.  It's not like I paid in in the ned.,"For me, sales tax.",1,"Social security, uh....that was 9 years ago",0,0,"Roads, health care, not sure what else","Congress' salaries, trips, insurance",Yes - my health care is full through the state,49,spending it on themselves,3,,3,,9,1,3,1,15,1,3,3,4,2,1,3,5,3,24,48,1,3,0.782012106
Georgia,1,6,4,Tax for everyone a must to the IRS.,1,100,last year filed next return.,Have to paid tax to the IRS.,income tax,1,federal tax,4,4,yes I bet somewhat glad to pay.,none I guess about upset.,yes I think so ,99,waste tax dollars of the people.,1,pay more to the family,1,alright for that part.,1,4,1,1,98,1,1,1,1,4,4,1,1,1,11,29,1,19,1.302865633
Connecticut,1,5,4,having to budget a lot more...,1,75,whenever you buy anything,sucks,property taxes,1,"social security, state, federal, ",1,0,education and social security,"politicians high salaries, excessive military spending, ",school system,70,"politicians high salaries, secret service for former presidents, wasted money on elections, wasted money on sending military to other countries where we make no difference in the long run",2,helps slightly but not enough,2,I think it is necessary because the cost of raising a child these days is very expensive,4,4,2,1,1,1,3,3,4,1,2,3,1,1,7,37,1,16,0.503497879
Illinois,1,5,5,"too high, too complex, too much waste",1,46,had lunch. Paid a 7% tax on it.,"neutral, at least I have a job and can offord taxes",Property tax.,1,State and federal income tax. Social security. (if that is considered a tax),0,Myself and my wife.,"Schools, roads, police, fire dept, national defense.",Welfare and social security cheats. Abortions.,"Yes. Taxes support local and federal infrastructure, schools, police and fire depts, national defense.",21,"Burocracy, (helium reserve), roads to nowhere, welfare for drug addicts, ",1,It reduced our taxes somewhat.,1,Earned income credit does help low income families.,1,5,1,1,40,1,3,2,4,2,1,3,1,1,14,23,1,13,0.631508565
Ohio,2,2,4,money deducted from paycheck to help fund government services,1,91,sales tax on household items,like I'm contributing to society,income tax,1,"fica, social security, city, state",0,0,"policemen, firefighters, infrastructure",can't think of anything else,"yes, peace of mind",41,research on obvious things,1,reduces them,2,good idea,5,2,3,1,50,1,2,2,4,2,1,3,1,3,36,23,1,5,0.427902551
California,2,3,1,to high or raise taxes always raising taxes on people that can't afford it,1,61,food taxes state and federal,do not like it,federal,1,state and federal,1,no,"children emergency funds, policemen, state funds",social sec that you may not collect on when you grow old,I'm not sure about that. I gaet confused about what is what.,81,any kind of equipment,2,don't pay as much taxes,4,,6,2,2,1,49,1,3,2,4,4,4,6,5,3,5,23,1,10,0.3930594
Georgia,1,2,5,Complicated and a burden on the ordinary citizen,1,51,Paid sales tax at the grocery store ,burdensome,federal income tax,1,"Federal, state, fica, medicare",0,no,strong military and elderly care,"food stamps,  welfare, supporting planned parenthood ",no,18,"education department, EPA, ",3,,3,,6,5,1,1,27,1,2,4,4,2,1,3,1,1,11,24,1,12,0.432154266
Florida,2,5,4,"unequal, those who can pay don't and those who can't pay too much, the system needs to be redone.",1,50,tax on purchase every time I bought something.  ,"its ok, would be better if the taxes would be better distributed with the programs that they should be funding.",local and state purchase taxes,1,"federal income, ss tax, state and local taxes",0,0,"social programs that actually help people get back on their feet when they need it. Medical, cash, and food,","Excessive salaries of any one.  salaries should be like the rest of the country, not outragously over and above the rest of us.",use programs that taxes paid for where I was not charged to use,80,"a hammer for $25,000.00",1,wonderful when it applies,1,it is good should be expanded,1,4,4,1,81,1,4,3,4,1,1,6,3,1,10,24,1,14,0.506566333
Virginia,1,3,5,how much I dislike government policies,1,70,federal tax this past April,not especially good,none,1,"federal and state withholding, fica, medicare",0,0,cannot think of anything that my paid taxes make me feel glad about,welfare for people who are to darn lazy to work,no I do not feel that I have benefited from my tax dollars,80,"welfare cheaters, unnecessay studies",3,,3,,6,5,2,1,19,1,2,2,4,2,1,3,3,1,47,12,1,11,0.631671616
South Carolina,1,4,5,government out of control spending.,1,60,The other day at the store.,Alright I guess.,land tax.,1,"Federal, State, FICA, SS.",0,No.,Social Security and Armed Forces.,Wasted money on un needed programs and the millions on false energy infeastments.,Social Security and Medicare.,60,"Celintra, rases for senate, Oboma's to meany vacations and his waestful spending on stupid stuff.",2,None any more.,4,,6,7,2,1,19,NA,3,1,4,1,1,6,3,4,41,26,1,10,0.432154266
Minnesota,1,4,2,lowering retirement income,1,60,at the grocery store a couple days ago,its ok if the taxes do not get raised,property tax,1,"fica, state",0,no,should be social security but congress both parties screwed that up,pork barrel projects that do not seem to be worth mich,"highway systems, most advances today can be traced back to military research funding, highways included per eisenhower",60,congress and senatoe perdiem,1,does not any more,1,help slightly reduce financial burdens,1,4,2,1,31,1,1,2,4,1,1,2,1,1,24,20,1,17,1.624211387
Ohio,1,2,7,money collected by the federal and sate governments,1,29,"on wednesday october the fiftheen, 2014",it sucks,sales tax,1,"federal, state, fica",0,no,the security of this country,stupid pork projects that do absollutely nothing to better mankind,nothing more than i have previously stated,81,"again, nothing more than i have already statedd",1,it doesn't affect me or my fam ily anymore,3,,6,6,1,1,9,1,1,1,2,2,1,1,3,1,36,18,1,4,0.427902551
New York,2,2,4,more money to pay for anything,1,81,today at Walmart for the things I bought,terrible,tax on clothes,1, / fica,0,no,my social security benefits,foolish programs that only a select member of people benefit from ,I receive social security benefits,99,programs for foolish projects,3,,3,,6,4,3,1,12,1,4,4,4,2,1,3,1,3,33,3,1,9,0.627845355
Hawaii,2,3,2,Yearly filing of money made ,1,38,I paid taxes on my meal today ,Sucky,Don't know ,1,Fico,0,0,I am happy to contribute to Social security ,Welfare people who are cheating the government,Yes in a way I was helped out for being a single mother ,33,Stupid testing ,2,Extra money back,2,Good to have,1,3,4,1,55,1,3,3,4,4,4,6,3,3,12,40,4,9,1.834465926
New York,2,3,1,"GOVERMANT,H&R BLOCK,INTERNAL REVENUE SERVICE",1,60,EVERY TIME I GO TO THE STORE I PAY TAXES,OK,FOOD,1,FEDERAL AND STATE,0,0,"IMPORT EXPORT,WELLFAR SOCIAL SECURETY","NO I WAS NOT UPSET,EVERY PERSON SHOULD PAY",FOR RETIREMENT OR ILLNESS,0,NONE,4,,1,A GOOD IDEA,6,7,3,1,51,1,3,3,4,1,4,6,1,3,33,19,1,2,0.341164062
North Carolina,2,6,4,"the internal revenue service.  Also, money that the goverment requires that you pay.",1,42,I sent a check to the internal revenue service,Do not like it,gains,1,"social security, federal state, and medicare",2,no,"education, kids that need assistance",People that can work but are not and then our taxes dollars go to subsidize them,I presume the roads that I drive on,64,spent inefficiently,4,,4,,1,4,2,1,41,1,2,4,4,2,1,3,1,1,34,40,1,NA,0.949593622
California,1,5,7,"democrats, who want to tax everything",1,80,sales tax today for lunch,no special feelings either positive or neagative,sales tax,1,state and federal taxes,0,0,"services, such as fire and police",taxes that fund things that are of no interest to me,there are services that have been of use to me as mentioned previously,50,payment for parts for government jobs,2,does not affect today,4,,2,6,3,1,42,1,3,3,4,2,1,6,1,1,5,17,4,19,4.423381849
Colorado,1,2,4,Democrats raising taxes for big government,1,52,Last year I paid taxes during tax time,Like I'm giving money at gunpoint to a corrupt government,employment tax and sales tax,1,"Federal, state, social security",1,no,"Helping run base government offices, police, and fire department. Schools used to be on the list until the Unions started running them.","Waste, supporting people that are not here lawfully from other countries, wasteful grants, Dictator Obama, his family and there vacations! I.R.S., CIA listening to Americans and looking at e-mails of Americans, Too many government wastes to list.",no,85,"Illegal immegrents, and government spending",2,don't know,4,,3,6,1,1,2,1,1,1,4,2,1,3,1,1,6,33,1,14,0.460739774
New York,1,6,1,Contributions to a governmental entity that help it carry out its functions,1,99,I. Paid sales tax on purchases that I made yesterday.,Great,Income tax,1,"federal income tax, state income tax, Medicare, social security",0,0,"Roads, defense, safety net for the poor and elderly.",High pensions for elected representitives,"Infrastructure, subsidized student loans.",6,Uncxollected taxes that are owed to the government,3,,1,I think that they are helpful for those who can claim them,6,2,1,1,9,1,1,1,4,2,1,3,1,1,33,20,1,15,0.503497879
Tennessee,1,2,3,"don't know,republican will raise taxes for poor and lower for rich",2,90,Draw social security disability,Don't know,None,1,Over 12 yrs ago,0,0,"None,when I was paying taxes,didn't get much back,after paying in alot","Most of everything ,didn't have much",None,70,When most isn't for the people,3,,3,,9,4,4,1,48,2,3,3,NA,2,2,6,3,4,43,39,1,2,0.627293163
New York,2,6,1,"Mandatory payment of portion of income to government to fund social and government services.  Also comes to mind that the tax system in the US is regressive (i.e., more burden on lower income) rather than progressive (higher income earners should pay more or at least same rate as lower income classes).",1,66,"I pay quarterly estimated income taxes on self-employment income; last payment was in Sept.  I also pay sales taxes on all non-food items purchased, so that would have been this past week.",A good citizen.,Income taxes.,1,Income taxes.  Social security taxes.  Medicare taxes.,0,No,"Infrastructure (roads, etc.).  Unemployment.  Medicare.  Government services.","Defense.  Wars.  Special interest projects.  Corporations who use tax laws to get out of paying virutally any taxes, especially compared to the income/profit they receive.",Infrastructure.  Local government services.,40,"Government beaurocracy--too mahy employees/levels of government that leads to ineffeciency (e.g., VA)",3,,3,,1,3,2,1,10,1,2,2,4,2,1,3,1,1,33,27,1,16,0.503497879
District of Columbia,2,2,2,I think about people paying there taxes.,1,88,I paid my taxes in lst month,I feel okay.,i dont know,1,I can't remember at the momenr,2,2,I hope it paid for cleaning the enivorment and the dirty fishing waters because it a mess and it stinks.,nothing I can't think of.,"no , and I don't know",61,just some unessary things ,4,,3,,1,3,4,1,6,1,4,5,4,1,4,6,5,3,9,49,2,8,2.067269469
Florida,2,6,1,They always go higher and they need reforming,1,82,I paid sales tax on some items I bought today.,We all have to pay our share to keep government going. / ,Property taxes,1,Withholding taxes,0,No,"The library, social security and Medicare",Political races and campaign coffers,Yes because now I collect Social Security and Medicare,19,Hiring favorite contractors,3,,3,,6,2,1,1,42,1,1,2,3,2,1,6,3,1,10,22,1,12,0.432154266
New York,2,5,5,uncle sam wants to take my money,1,54,sales tax to department stores,none,none,1,,2,0,"pays for education, interstate highway, etc.",for welfare and the poor that are not really poor,none,58,none,2,it lowers and saves me some money,2,it's a great incentive to have kids,1,3,2,1,58,1,2,2,2,1,2,2,1,1,33,38,4,15,2.349898524
California,1,6,4,Devil but necessary to government to maintain operation.,1,95,Pay income tax and consumption tax,Responsibilities and obligations,income tax,1,income tax,1,None,more focus on welfare and health sectors.,much more for military expenditure,Be contributing reasonable goverment operation.,70,The huge  Military Spending,1,reduce the mount of my earnings,2,necessary but should be less ,1,4,1,1,50,1,2,2,4,2,2,3,1,1,5,51,1,19,2.165646716
Michigan,2,5,2,Money paid to the government to help fund public services,1,71,Paid sales tax on a grocery shopping trip today,"It feels kind of frustrating seeing part of your paycheck disappear, but I also know it is important for many reasons, and necessary to help fund important public services",Federal Income Tax,1,"Federal Income, Social Security, MI State Tax",0,No,"Public Services, Education ","I think there is too much unnecessary spending on national defense, wars","Yes, I received a very good education in public school, I live in a community with a great hospital, police department, fire department, etc",5,"Nothing specific, there's just bound to be waste somewhere",3,,2,I don't know too much about it,1,2,2,1,60,1,3,3,4,2,1,3,5,1,23,60,1,13,5.00008301
Florida,2,3,6,exces government spending,1,60,weekly taxes deducted from my paycheck,part owner of the local/state/national government,local property taxes,1,federal and medicare,0,1,police & fire departments,all of Obama's administration,"police, fire protection, trash & recycle pick up plus streets & roads we drive on",55,federal goverment,3,,4,,2,6,3,1,32,1,1,2,3,1,1,3,1,1,10,21,1,NA,0.519600055
Kansas,2,2,2,hopefully helps with programs in my area,2,80,not sure when I paid taxes,ok,house,1,local,0,no,streets education and home,I am not upset at what tax dollars pay for,no,60,trash,3,,3,,8,4,NA,2,60,2,4,NA,4,1,2,6,1,1,17,49,1,13,1.154111704
Massachusetts,2,2,NA,taxes on the house or anything you own ,1,99,my car  and the house I once own,okay as people pay what they need to pay and not goof off,fininaces for the car and the house it depends ,1,SSI and State ,0,no,anything that is good and worth it you need ot pay taxes for,you need a job to pay taxes or u will get into trouble,yes working all your life you should have the benifits to get it back at the end of the year,100,not to sure the only thing I think about it recycle,1,not sure what we need eveything goes it to it,1,cool when u go to school and at the end u get credit ,2,NA,NA,2,60,2,4,3,4,4,4,6,3,4,22,32,1,1,0.341164062
