statename,gender,educ,partyid,firstthought,taxpayer,percenttp,recent,tpfeel,biggest,wagesal,paystub,child,depend,glad,upset,benefit,wastecents,wastethink,eitcself,eitcexp,eitcother,eitcthink,labforce,polideo,polinffreq,regvote,feelfedgov_1,voted,discusspol,poleffic,polvol,polknow1,polknow2,polkno3,marital,ownhome,stateresid,yearbirth,raceeth,hhinc,weightvec
Virginia,1,2,3,Money that is usually wasted or stolen to stuff in the pockets of crooked politicians who use it only to do what they want to profit later themselvess from while in office,1,50,Sales tax on what I bought at the store....the normal in Virginia,Like I am a normal citizen not some immigrant that our president wants to let in our country and keep up because they can't work and cant speak english and cant do anything but are tax exempt if they do find any work and our president wants us to keep up the million of illegal aliens in our country or at least keep their kids here and feed them and keep them up with tax payers money that should be used to pay our country debts but is instead used to keep up Obama's cousins,income tax of course,1,state and federal withholding,5,no,Nothing they only pay to feed illegal aliens as far as federal now local tax at least pay our police officers who are a bunch of Barney Fife's like on Andy Griffith but at least they can direct traffic when a light is not working,Illegal aliens to even be in our country at all,no..none what so ever only Obama has for 8 years and the illegal aliens he supports that should never be allowed in our country....all our country jobs went overseas or to other countries so let them stay in their own countries pay their countries taxes and work their....just lazy illegal aliens looking for a free tax exempt ride,100,allowing illegal aliens to be keppt up fed with food stamps  get government grants for buisness and so on...and also they waste it doing anything to help a company that will help then prosper later after they arre out of office...all crooked rich men and women who dont believe in God and only worship money except Obama who is islamic aand needs to be presidents of Iraq and Hillary Clinton who is a lesbian and I think Bill Clinton should have not only had the affair years ago in the white house with Monica but he should have left his sorry excuse for a wife Hillary long long ago....Bill Clinton was a better man and President than Obama and Hillary could ever be put together,2,the year we got it...it helped but our government should make it to where people who are too lazy to work all year dont qualify only the famlies that do something besides lay on their backs making babiess to get the food stamps and extra tax break....too many young women get knocke up only to get a free ride and couples dont marry because food stamps they get lying about living together....our government system doesnt work because we have way too many rich ass holes in washington without a clue as to how people are really using their so called syystem,1,too many people are abusing it but it does help the occasional family that really deserves and needs it but there are 10 women abusing it for every one that really needs it...too many people lay around on drugs and have babies and qualify and do nothinng to take care of their child or themslves the child is raised by their family yet the government gives the drug addictss more money its a waste mostly,1,4,1,1,0,1,1,1,4,1,1,6,1,1,47,43,1,10,0.789782315
Tennessee,1,3,2,the rich pay less than middle class,1,65,"Ipay some kind of tax nearly everyday, sales tax, use taxes, payroll",burdened,sales tax,1,"income tax, social security tax, medicade tax",0,1,"police, fire dept. highway improvement","money to countries that hate our way of life, burn our flag",very little if at all,57,foregn aid,1,larger refund,1,I approve of this credit,6,2,1,1,47,1,2,2,4,2,1,6,3,3,43,22,1,4,0.343243209
Texas,1,2,4,A goverment collecting money from the people to pay for services,1,60,"Payrole tax,sales tax, tax on gas, tax on land",It cost to much ,Tax on land,1,"Payroll tax, medicare",1,no,"Roads, education, helping people make ends meet","The wars overseas, wasteing money on people that will never like you",Not sure,80,Just about all they do,1,It helps with extra money,4,,1,4,1,2,20,2,2,2,4,2,1,6,1,1,44,29,1,11,0.432154266
Maryland,1,5,3,It is always an issue and will never have an agreement.,1,50,I went to Burger King for lunch.,It suck,Income,1,Federal,1,Yes,Pretty good infrastructure.,Earmarks handed out by Congress.,No,40,Congress,1,I put that money to my son's 529 plan,3,,1,3,2,1,19,1,3,3,4,3,3,3,1,1,21,43,4,11,2.016927406
Texas,1,3,1,payments to the government ,1,61,just taxes from my regular pay check,Feels basic,none,1,For programs,0,0,For social programs that I will use in my future,nothing at all. Not upset over anything,I will when I get my SS and medicare when I'm older,5,Military spending,3,,3,,1,1,4,1,33,1,3,3,1,2,1,3,5,4,44,58,1,12,4.87722426
Ohio,2,2,4,LESS MONEY IN POCKET HIGHER RATES,2,61,SALES TAX AT A GROCERY ON NON FOOD ITEMS,"OK, IT IS HOW IT IS",SALES TAX,1,BEEN SO LONG AGO DO NOT REMEMBER SPECIFICS,0,0,"INFRASTUCTURE, HEALTHCARE, HUMAN SERVICES","ILLEGALS IN THIS COUNTRY, WHEN WE HAVE NEEDY PEOPLE HERE THET DO NOT RECIVE SAME BENEFITS",NO,40,"GOVERNMENT HAS HIGH SALARY, OWN INSURANCE, SHOULD LIVE LIKE MOST AMERICANS WITH SAME STANDARD OF BILLS THEY PASS FOR US TO LIVE BY",1,ALLOWED US TO PURCHASE SOMETHING WE NEEDED OR PAY OFF A DEBT,1,PARENTS DESERVE IT AS IT IS SO HARD TO LIVE THESE DAYS AND RAISE A FAMILY WITH THE PRICES EVERYTHING IS COSTLY,8,6,2,1,0,1,2,1,4,4,4,6,1,3,36,22,1,4,0.427902551
Louisiana,1,2,6,government more politicians wanting to waste my money,1,40,January 2014 federal taxes and property taxes,terriable,income taxes,1,income and state taxes,0,o,at this time im not happy raying any,every one that is in government,have not benifited at all,80,illegal immagrants,3,,3,,6,6,1,1,1,1,1,5,4,2,1,3,2,1,19,10,1,12,0.631671616
Alabama,1,5,7,"big government trying to control every aspect of our lives and economy, taxes are way too high and would be better if lowered",2,49,"sales tax on a TV, it's 8.5 percent here in my town","it's a major burden, it takes away from my own hard work","sales taxes, my brother's income tax",1,"FICA tax, payroll tax, 401 K",0,0,"roads, schools, research, military",massages for rabbits and the other useless government boondoggles,"somewhat, roads and schools have helped me",46,giving massages to rabbits,1,it helped my family make ends meet,3,,1,6,1,1,25,1,1,1,3,2,1,3,5,4,1,42,1,7,0.789782315
Ohio,1,2,6,more money out of my paycheck,1,70,"I pay taxes every day when I buy something,when I bought gas today I paid taxes",not that great,income taxes,1,"federal,medicare,state,local",0,my wife,I am glad my tax dollars pay for roads and emergency funds,"obamas wages,studies,nasa,",well I can drive on nice roads.I can retire in a few years(maybe),40,flying all over the country on air force one.we overpay for everything it seems,4,,1,"I am not sure,I think it has helped some people",2,5,3,1,50,2,2,4,4,2,1,3,1,1,36,23,1,10,0.538743107
Illinois,2,2,2,costly amounts added to things you purchase,1,80,last week on groceries I bought,not good,payroll taxes on partners paycheck,1,"social security, state, federal, fica",0,0,social security and unemployment,issues that occur in other countries,no I do not,60,spending on issues in other countries,1,it was about 25 years ago   don't remember,3,,6,4,4,2,40,2,4,5,4,4,4,6,3,3,14,19,1,11,0.538743107
Tennessee,1,3,7,"Democrats ,social programs , social security , medicare , medicade .",1,39,when i purchased an item at the grocery store . ( sales taxes ) .,over burdened with too much tax .,income tax ,0,,0,0,"roads , street lights , libriarys , fire men ,police , emergecy sericves ","ssi , ssa for unwilling to work ,government  sponsered programs such as , how long it takes for kepticept to run . etc.","to keep the government open , only to do necessary jobs , such as , social security checks mailed , militiary checkes mailed out .",91,"President using air force one to do his personal campaning ,for the demacrates , . The President  & wife  taking seperate jets to go on vacation , We the people are incouraged to buy a cracker box  electrect car  , mini  cars are more likley to be destroyed in an accident . Mainly the driver could be killed in a crash ",3,,3,,9,7,1,1,31,2,2,1,1,2,1,1,5,1,43,24,NA,NA,1.326942338
Florida,1,5,4,pay  higher taxes to be paid no matter what,1,93,april 15 2014liquor and grocery bill taxes tobacco taxes,terrible,income tax,1,fica medicare witholding,0,2,nothing  it all goes to the homeless and poor and middle class gets no benefit,homeless you should always say that you must use 25 characters to continue,no and i probably never will  only the rich survive,69,help to other countires and not enough help to the middle class,3,,3,,6,4,3,1,11,1,3,5,4,1,2,6,1,1,10,14,1,16,0.74043831
Ohio,2,4,3,is a fee that the government charge for living in USA,1,70,"the last time that i pay taxes, were for the annual income tax ","pain full, because is less money for my family and me, and more for the government to spend to declare war to other countries ","mortgage, retirement and college savings ",1,"medicare, state withholding, state withholding and social security tax",2,no,helping people who really need it ,lot of money spend on national security and helping people who does not really need it ,nothing that i can think of ,93,wars and retirement and disability benefits to federal employees ,4,,3,,1,2,3,1,51,2,3,2,1,1,2,3,1,1,36,44,3,16,2.947343188
West Virginia,2,3,4,"less money in pocket, high, IRS, government waste",2,60,I paid taxes on any non-food items when I went shopping yesterday.,Like we're being overtaxed for everything.,vehicle yearly taxes,1,"state, federal, social security",0,0,"schools, fire/police department, Social Security, SSI, public libraries","corporate bail outs, foreign countries, immigrants that came here illegally, welfare recipients that are using drugs, wasteful spending of any kind ","Yes, but I'm not going to state why.",60,Paying Obama a salary for destroyng our country.,1,"I don't pay federal taxes any longer, but it was helpful in using the monay to catch up on utility bills from winter each year.",1,"I think for a lot of families and individuals that it helps them get bills caught up and get things for their family that they normally couldn't afford, but there are a few  that spend the money on drugs instead of the families.",8,4,NA,2,20,2,3,3,4,1,1,6,3,1,49,34,1,6,0.432154266
Massachusetts,1,3,6,A requirement in today's world,1,80,Today...A sales tax on goods purchased,"I don't think about it too often, but I guess I really don't like it",Federal and state income taxes,1,"federal, state and social security",0,1,National and state infrastructure,Welfare for those able to work and illegal immigrants,"Yes, I imagine I have in government and state services",40,overpayment for goods and services,1,At the time I was able to claim the child tax credit it reduced our taxes owed,1,I think the child tax credit is a big help for working families,6,3,3,1,29,2,3,4,4,1,2,6,1,1,22,21,1,17,1.294973709
Texas,2,3,7,The law required by government,1,69,I pay tax on every paycheck I receive,Overwhelmed at times,always and forever government taxes ,1,Social security and Medicare,0,1,Retirement so that I will have extra income,Government salaries especially for irs and politicians,I haven't benefited at all ,95,foreign aid and welfare,1,it means i can pay a little less in taxes,2,Children are expensive and every little bit helps,1,7,1,1,11,2,2,2,4,2,1,3,3,3,44,32,5,11,1.103625348
New York,1,4,2, a loss of money from my income,1,82,I paid any kind of tax today,it does not feel good at all ..,income tax is the one ,1,federal state city income tax,0,0,I can't recall any at this time,I don't recall any at this time,no I don't know how,20,nothing speccific came to mind,4,,4,,6,4,3,1,51,1,3,3,4,1,1,6,1,1,33,23,1,15,0.503497879
Wisconsin,2,3,4,necessary to run the country,1,13,2013-paid state and federal taxes,"don't mind paying some, but I don't make that much money",federal tax  is the biggest amount with state second,1,"fica, state, social security, ",0,none,"roads, schools, security of our country",people who scam the system and get money not meant for them,I had a good public school education,40,"stupid studies that don't make sense, paying too much to our congressmen!",3,,4,,6,4,2,2,10,1,2,1,4,2,1,3,5,3,50,15,1,8,0.787470485
California,1,2,5,something needed but not over used,1,59,yesterday sales tax buying items at the store,what makes america run,pay check,0,,0,0,safety of our land air force navy army marines roads parks ect / ,wasting money on dumb programs paying 10 dollars for a 10 cent nail ect,roads parks ect,59,I watch road work where they fix the road and a week later tearing it apart and fix it again ,3,,1,no thought on the credit ,1,5,3,1,60,1,3,2,4,1,1,6,1,1,5,37,1,13,0.460739774
Alabama,2,5,7,property tax; income tax; sales tax,1,98,I paid sales tax at the grocery store this week.,"I feel as though I am paying my part of the 'upkeep' for my county, state, and country.  I feel aggravated when paying the IRS because I think the Federal Government squanders our money.",property taxes on house and vehicles,1,"FICA, SS, Federal, state, local (hardly ever had anything local) ",4,no,infrastructure (road repairs - so much better than other countries!); police and fire departments; schools (though I'm disgusted with Common Core and lower standards even before that),"foreign aid of all sorts (including weapons, fighter jets) sent to our enemies; over-stuffed retirement packages for politicians; levels upon levels of bureaucrats who do no productive work","I would like to think that some of the taxes paid for the US military to be trained and equipped to protect our country.  Evidently, it did not pay well enough for the VA hospitals to care for veterans properly...",80,Spending on projects which were never completed; paying exorbitant amounts for parts & services; employing useless bureaucrats; paying outrageous retirement funds for politicians; and THE BAILOUT!!!,1,It reduces the amount of Federal income tax we pay.  It does nothing else in particular.,4,,9,6,1,1,10,1,1,1,4,2,1,6,1,1,1,38,1,15,0.92577388
Virginia,1,2,4,a bunch of Crooks in our government,1,85,last year like everyone else,it sucks these days because most of it goes to waste,Federal and state,0,,0,1,nothing at the moment from what I see,Crooks to be able to wine and dine on our money,hell no in any way,98,all the crooks in office,1,helps a lot qwhen i get it,3,,1,6,3,1,46,2,2,1,4,3,3,6,3,1,47,33,1,10,0.432154266
Washington,1,2,4,no accountability on spending of taxes. / ,1,61,when i purchesed a controller for my game station. I pay nearly 9% in state taxes on non food purcheses,unfairlly burdened. tax the people with the money.,state taxes on non food itemes,1,"state, federal, fica, ",1,no,"somewhat glad, more accountability would be nice",sometimes i am upset regarding this issue,"no, not many programs to help single fathers.An unbalanced system, once again",40,survailence of citizens,2,it doesnt affect us,2,guess it is a decent system,9,2,3,2,39,2,2,3,4,1,2,6,3,1,48,42,1,2,0.570545043
Michigan,2,2,7,To much money out of my pocket.,1,70,I pay tax every time I go to the store. If you're talking about government income tax or land tax. We paid our summers taxes in September.,It feels good that my husband has a good job to pay taxes as to many free loaders live in this country that we have to pay for. I love my country. But there is to may outsiders here.,Income tax,0,,0,Just my husband and I.,Our service men and women,Giving Illegal Immigrants our hard earned SS and freedom. They need to send them back to where they came from and shut down the borders. Such as Mexico!,Government hasn't done anything with it to make me feel I've gotten anything from it.,97,the was they spend it on science project. Such as how frog in Bornio reproduce.,3,,3,,8,7,1,1,17,1,3,2,4,2,1,6,1,1,23,17,1,13,0.923063978
Arizona,2,4,6,That as a citizen it is a duty,1,51,Today when I went shopping,Not too good because too many people do not pay or cheat,Income tax,1,"Federal, State",0,no,"Roads, Medicare, Police, ","Welfare, overpaid government employees, unnecessary trips and conferences ","Yes, I get police protection, good roads and all kind of necessary benefits",83,"Projects that make no sense because they are not necessary, welfare, going to space when we need things on earth ",3,,4,,8,6,1,1,12,1,2,3,4,2,1,3,1,1,3,23,1,14,0.460739774
Ohio,2,3,6,taxes means my hard earn money out of my pocket which goes to the government,1,70,The last Time I paid some taxes came from my pay check,I believe in paying my fair share of taxes but everyone needs to pay,The biggest part of my budget comes from my small pay check,1,Federal / State / Social Secuirty,0,0,My tax dollars pay for my medicare & social security which I had to take since I was laid off 3 years ago.,I am upset about my tax dollars pay for unnecesary wasteful spendings of the government,I receive Medicare & social security now since I was laid off 3 years ago,37,The Government waste tax payer dollars by all the vacations & business expenses which are written off,3,,3,,4,5,2,1,20,1,2,3,1,2,2,3,3,1,36,17,1,10,0.787470485
Virginia,1,4,2,Having to make additional payments.,1,90,Sent a $2000 payment to the IRS.,"Paying for all of the services, that are needed to help to run a country, and the state that we live in.",Federal taxes.,1,"Federal, State, FICO, Unemployment, and Social Security taxes.",0,Wife,"Military defense, Coast Guard, Federal Government employees including the President, Congress, Senate, and Federal Courts, and many more extras that we may take for grant.","For not being able to get the Federal Deficit under control, along with the people getting tax dollars that they not entitled to.  Ex: Doctors over charging Medical.","Yes, when I became Disabled and qualified for Social Security.  And I have been receiving Disability for the last 9 years.",11,"The small riders added to every bill, before sending the bill to the President to be signed.",1,"A tax credit, reduces the actual taxes that need to be paid.  Ex: Your total tax bill is $2000, and a tax credit of $300, so your total tax bill will be $1700.",3,,9,2,1,1,75,1,2,4,4,2,1,3,1,1,47,22,1,17,1.302865633
Texas,1,3,3,Internal Revenue Service and their system of taxation especially how the middle class get the brunt of paying taxes while there are loopholes galore for the rich.,2,86,The last time I paid taxes of any kind was back in 2007.  I am now disabled and my only source of income is Social Security Disability.,"Like I was trying to pay my fair share to the Internal Revenue Service, but they wanted more from me.",It use to be income tax when I was working.,1,FICA &  Social Security,0,0,"Social Security, Education, programs to assist the less fortunate","Military waste, stockpiles of food that we should be distributing to the poor and needy.",I am now that I am collecting Disability and a food stamp stipend.,70,The military!!!!!,3,,1,I think it is fair for families with dependent children,5,2,3,1,40,1,4,1,4,4,2,1,2,3,44,27,2,4,0.876566393
Ohio,1,2,6,the taxes are to high and for how thegovernment spends it on is crazy.,1,66,sales taxes on anything one buys.,kind of over used and cheated.,income taxes.,0,,2,my wife,helping the unfortunate families.,,yes trough the earned income  credit.,73,thier payroll,1,gives back alot more money.,2,it is very helpful to low income families.,1,3,3,1,40,1,3,3,1,2,2,6,1,1,36,37,1,6,0.538743107
New Mexico,1,6,1,necessary for a civil society,1,30,yesterday  when I paid the phone bill,responsibly and exploited,property taxes,0,,0,0,"national parks, food stamps, environmental safety",war and weapons and bridges to nowhere,"certainly - social services, paved roads, a man on the moon",19,the pentagon and bloated defense contracts,2,minor,2,helps equalized things,1,1,1,1,5,1,1,2,2,2,1,3,1,1,32,27,1,13,0.460739774
Alabama,2,6,3,having to give the government more money,1,60,At the store I had to have something from the grocery store and paid a sales tax.  I also bought gas and paid a gas tax.,I get frustrated that my money that I work hard for goes to pay taxes on things.,federal and state taxes,0,,0,0,Trying to find other more efficient resources than gasoline.,Helping all of these people in other countries,not really,99,energy,3,,4,,1,4,3,1,3,1,3,1,4,2,2,1,3,1,1,31,1,11,0.432154266
Texas,2,6,2,money what i should to pay country,1,60,last month from my paycheck,not very good because i pay a lot of money,salary,1,social security,0,0,don't know nothing glad to hear,big money that go to people who doesn't want to work,no,60,big salary,3,,2,none,1,3,2,1,57,2,1,NA,NA,2,2,6,1,1,44,28,1,17,1.302865633
Pennsylvania,2,6,1,necessary in order to run the country and the government,1,100,sales tax on a purchase and taxes on utility bills etc.,it feels like something that is expected and I'm willing to do,"either income taxes or property taxes, I'm not sure which is larger",1,"income tax, fica, state income tax",0,0,"schools, military, infrastructure, etc.",tax breaks for huge corporations and very rich people!!!,"of course, we all benefit from money spent for infrastructure, armed forces, social security, medicare",19,"too much money spent on congressmen's pet projects, also the military",3,,4,,6,2,2,1,50,1,3,2,4,2,1,3,1,1,39,13,1,17,1.892838277
Illinois,1,5,6,"politicians, lawyers, Mexicans, educational bureaucrats, government workers, city workers, county workers, township workers, state workers, federal workers, teachers, deadbeats, fraud, mismanagement, corruption",1,50,"Last year's tax return, 4/15/2013",Lousy,"Federal income tax, property tax",1,"Fica, state, Social security, federal",0,0,Killing terrorists and Muslims with missiles and drone aircraft,"Mexicans, lesbians, politicians salaries and benefits, excessive compensation to teachers","No. That money goes to bums, deadbeats, Mexicans, Negroes and lesbians",100,"entitlement programs, medicare, social security, defense, farm subsidies, corporate welfare, education spending",1,Negligibly,2,It's a negligible amount of money,1,5,4,1,0,1,2,3,4,1,1,3,5,1,14,30,1,13,0.631508565
Kentucky,2,3,6,Extra charges that go to Social Programs,1,70,Property Taxes for the Year of 2013,Taken advantage of,Everything but food,1,"Fed, State, School, FICA, Surcharges, Regulative Taxes",0,0,nothing really.  I am upset by taxes that I don't understand why I have to pay for School taxes when I don't even have Children.,School Taxes because it's unfair that I have to pay for them when I don't have Children.,yes,61,Benefits to Gov,3,,3,,9,6,2,1,59,1,3,1,1,2,1,6,3,1,18,24,1,3,0.343243209
Colorado,2,6,4,"burdensome, stressful and annoying",1,71,"Sales tax, just yesterday to purchase new clothes",It feels incredibly annoying at times,Income Taxes,1,"Social Security, FICA, State",1,no,Education and social security ,welfare (when people abuse the system),"Yes, for government services such as roads",49,Spending needless money on administration,3,,3,,1,4,1,1,60,1,1,2,4,2,1,3,1,1,6,41,1,19,2.165646716
California,1,2,2,"Tax returns, I get a check and know when I pay taxes some of the money comes back to me as a tax return.",2,71,"I worked as a canvasser for Energy Designer Homes in Sacramento, Ca. ",The same as not paying taxes. A check is issued to me and I either pay taxes or I do not pay taxes.,None. I'm disabled and no one else lives with me.,1,Federal tax. ,0,0,Health care for someone less fortunate.,Nothing. I'm happy with everything my tax dollar pays for.,No.,1,Nothing.,3,,1,I wouldn't know because they have never talked about it to me.,9,5,4,2,100,2,3,3,3,1,1,6,5,3,5,36,3,1,0.797267752
New Hampshire,2,2,5,"Money, money and more money. ",1,45,I pay/paid my property taxes. ,Like I'm doing my part. Only wish others would do the same.,Income taxes.,1,"FICA, Social Security, Federal Taxes",0,no,"Roads and their upkeep. Plowing, patching, etc.",Abortions &  lazy people who could work,I like driving on nice roads. ,30,Congress,3,,4,,6,6,4,1,7,2,3,2,4,1,1,6,1,1,30,16,1,17,1.892838277
Colorado,2,2,4,I will immediately pay without much bicar,1,50,I last paid a year ago with my friend,very happy,home tax,1,yes,2,motorcycle,I am very happy to have to pay taxes,not because I always pay taxes,yes because they have to pay taxes,49,clean,1, furious,1,very good,3,4,1,1,50,1,1,1,3,4,2,1,1,1,6,61,4,4,5.000084473
Florida,2,5,3,"Money, government, responsibility",1,81,I paid sales tax on a purchase of clothing at Wal-Mart yesterday,I don't mind; I think it's part of the responsibility of living in a democracy,Federal income tax,1,"Federal withholding, state withholding, Social Security tax, Medicare tax",0,Spouse,I'm glad to support the military though I think we spend too much money on it; I am happy to have my taxes provide for improvements to our infrastructure; Veterans benefits; healthcare research; housing assistance for people who need it,Too much foreign aid; waste and spending pumped up by lobbyists,"Only to the extent that my tax dollars have supported programs that have benefited the country as a whole, made us stronger and a better, more educated country",40,"Welfare programs, pork spending authorized by Congress, programs the Pentagon doesn't even want that Congress authorized",3,,2,I think they help address the horrible inequality that exists in our country today,6,2,1,1,9,1,2,4,4,2,1,3,1,1,10,10,1,15,0.74043831
